{
  "Dates_of_All_Decrees": {
    "extracted": [
      {
        "evidence": [
          {
            "location": "Page 3 of 3",
            "source_document": "Judgment",
            "text": "IT IS SO ORDERED and DATED this 26th day of August, 2020."
          }
        ],
        "value": "2020-08-26: Judgment entry"
      },
      {
        "evidence": [
          {
            "location": "Header/sig line (tokens 0-709)",
            "source_document": "Order Granting Fees and Costs to Plaintiffs'",
            "text": "Signed 10/05/2020"
          }
        ],
        "value": "2020-10-05: Order signed"
      },
      {
        "evidence": [
          {
            "location": "Entry 47",
            "source_document": "Docket",
            "text": "Signed on 08/07/2019"
          }
        ],
        "value": "2019-08-07: Opinion and Order"
      },
      {
        "evidence": [
          {
            "location": "Entry 111",
            "source_document": "Docket",
            "text": "Ordered and Signed on 07/22/2020"
          }
        ],
        "value": "2020-07-22: Opinion and Order"
      },
      {
        "evidence": [
          {
            "location": "Docket Entry 114",
            "source_document": "Docket",
            "text": "Signed on 08/26/2020"
          }
        ],
        "value": "2020-08-26: Judgment signed"
      },
      {
        "evidence": [
          {
            "location": "Docket Entry 138",
            "source_document": "Docket",
            "text": "The decision is: AFFIRMED in part, VACATED in part, and REMANDED. (jkm) (Entered: 09/28/2022)"
          }
        ],
        "value": "2022-09-28: USCA Opinion vacating part"
      },
      {
        "evidence": [
          {
            "location": "Docket Entry 143",
            "source_document": "Docket",
            "text": "The APPEAL is: AFFIRMED in part, VACATED in part, and REMANDED. (jkm) (Entered: 04/18/2023)"
          }
        ],
        "value": "2023-04-18: USCA Opinion vacating part"
      },
      {
        "evidence": [
          {
            "location": "Docket Entry 147",
            "source_document": "Docket",
            "text": "The Appealt is: AFFIRMED in part, VACATED in part, and REMANDED. (jkm) (Entered: 07/06/2023)"
          }
        ],
        "value": "2023-07-06: USCA Amended Opinion vacating part"
      },
      {
        "evidence": [
          {
            "location": "Docket Entry 149",
            "source_document": "Docket",
            "text": "Defendant-Appellants motion to stay the mandate (Dkt. 101) is GRANTED. ... (jkm) (Entered: 07/17/2023)"
          }
        ],
        "value": "2023-07-17: USCA Order granting stay"
      },
      {
        "evidence": [
          {
            "location": "Docket Entry 155",
            "source_document": "Docket",
            "text": "Signed on 9/17/2024"
          }
        ],
        "value": "2024-09-17: ORDER Approving Settlement Agreement"
      },
      {
        "evidence": [
          {
            "location": "Docket Entry 157",
            "source_document": "Docket",
            "text": "Signed on 10/07/2024"
          }
        ],
        "value": "2024-10-07: ORDER Approving Settlement (vacating previous judgments)"
      }
    ],
    "key": "Dates_of_All_Decrees",
    "last_updated": "2025-11-16T03:15:53.382193-05:00"
  }
}